{
  "version": 1,
  "title": "Storage-arch seat map — decisions.md L1–L14 constructs seated in the target tree (the storage epic's mech suit)",
  "status": "cut_destiny",
  "privilege": "Architect seat contract only. decisions.md is sole Spec authority — this file yields on conflict. This instance CONSTRUCTS seats; it condemns symbols, not files. Nearly every seat is a NEW-SEAT proposal (marked in kind) because target-arch predates the Spec and has no seats for the L1–L14 constructs; existing store/session files extend. Claim-tag inflation voids this plan. Per the frozen preamble: Nonce / WriteAuthority / SnapshotFork constructor SIGNATURES stay unfrozen until the at-rest IncarnationId and live-fork SIV campaigns are green — stories may build the types and doors but must not seal those three signatures as Spec-frozen before campaign green.",
  "scope": {
    "this_cut": "Seat every storage-Spec construct: Store/Catalog/Engine types, StoreOpen, WriteAuthority, IncarnationId/IncarnationMintCap, SweepDoor + IntentOrdinal/CommitOrdinal, NonceLease pipeline, StableCommitCap arms, ObjectSlot/StagingTTL/PermanenceCandidate/ObjectDurabilityClass, CheckpointSeal, CanonicalTranscript, AdmissionCertificate/ReplicaKey/ReplicaCustody, CompositionId/OperationKey, AskShape/Footprint/Frontier, ForkGrant/RecoveryGrant/materialize, ShredSalt/WrappedShredSalt, the failure lattice, and the claim-tag ledgers. Downstream story-writers cut board stories directly from by_target entries.",
    "not_this_json": "Migration of legacy files (01–06). Federation transport (NATS driver, semantic router, manifests §15–18, §69–73 fabric halves) beyond the Store-owned vocabulary seated here — a federation epic seats the fabric; this instance seats only what the Store itself owns (see qae). Apps on Kyzo are out of scope by Spec.",
    "foundation_already_true": [
      "store/{contract,tx,fjall,backup,keys,merkle,retry,scratch,skip_walk,time,verify_walk}.rs exist (contract/tx as stubs pending 03)",
      "session/{admit,catalog,db}.rs exist (stubs/partial pending 02)",
      "kyzo-crashfs (fault injection) and kyzo-trials (campaign lanes) exist",
      "decisions.md is frozen; doubt takes campaign form only"
    ],
    "target_not_current": "by_target keys are target-tree paths; NEW-SEAT marks paths absent from target-arch that this instance proposes for ratification."
  },
  "authority": [
    "docs/decisions.md — sole Spec (seats cited §N)",
    ".claude/skills/architecture-map/target-arch.md — ideal paths (extended by NEW-SEAT proposals)",
    "docs/deprecated/storage-model/0{1,2,3}-*.json — sibling migration instances this map composes with",
    "This file — cut destiny; subordinate to decisions.md"
  ],
  "claim_tags": {
    "law": "Mandatory Spec tags from decisions.md only. Every unrepresentable re-tags under exactly one. Two proof forms carry the Unconstructible tag: TYPE-guarded (compile-fail a crate-consumer trybuild demonstrates — listed under ontology.unconstructible) and CONSTRUCTOR-guarded (a private constructor that inspects data the type system cannot see, e.g. cut ≥ expires_at — listed under seated_laws with DST meters, per §22's own constructor language). Conflating the two, or inflating Unexposed to Unconstructible, voids this plan.",
    "Unconstructible": "No path through the sealed Rust type and crate boundary constructs the illegal state. Relative to facts the process has observed; never claims to prevent offline dual-history a partitioned process cannot see (§2 preamble).",
    "Refused": "Reachable program; typed runtime outcome. The closed StoreRefuse ledger at store/failure.rs is the Refused claim-tag ledger in types.",
    "Unexposed": "Absent from the public API but reachable by a hostile adapter (cloned disk, snapshot fork, bit-copied keystore, partitioned oblivious writer, hostile binding). The unexposed section below is the Unexposed claim-tag ledger; every entry names residual + detection."
  },
  "joint_satisfaction": {
    "law": "Allowlist ⊇ every seat file the meters require. No condemned file paths — deletes are symbol-level (the fused-Db class). A story that needs a path not listed here amends this instance first.",
    "proof_pairing": "compile-fail for type-guarded claims; DST campaign for constructor-guarded claims; grep-delete for the condemned symbol class.",
    "no_condemned_rewire": "Not applicable at path level; the condemned symbols must not be re-minted under new names (ban list)."
  },
  "deletes": {
    "law": "Symbol-level E-actions executed across the storage epic. Grep-delete class — never claim-tag territory.",
    "paths": [],
    "symbols": [
      { "name": "fused public Db constructor / any 'open path → the database' facade returning storage + schema + evaluation as one ambient authority", "why": "§1: delete every such constructor; Engine holds Store/Catalog capabilities by composition." },
      { "name": "Store::put_record / app-direct claim upsert / chunk-as-fact write", "why": "§93: apps never mint KyzoRecord meaning." },
      { "name": "decrypt_export", "why": "§60: export leaves ciphertext; Store never decrypt-exports as a feature." },
      { "name": "open FsyncCapable-style bool on the commit door", "why": "§27/§74: durability capability is a sealed StableCommitCap arm with campaign, never an open bool." },
      { "name": "commit coalescing timers / timer-tuned SweepDoor parking", "why": "§25: wake ≠ timer; park only on queue non-empty or shutdown." },
      { "name": "durable lock records / lock-expiry timers / abandonment ceremonies for footprints", "why": "§36: footprints are session-memory indexed by (FenceEpoch, IncarnationId); prior-epoch footprints are not live locks." },
      { "name": "tenant-weight or conflict-history scheduler inside Engine", "why": "§43: writer competition is AskShape/Footprint law, not Engine adjudication; fairness is host-only." },
      { "name": "mutable watermark / consume-reissue on WriteAuthority", "why": "§2: WriteAuthority is an immutable affine signing capability; all mutable floors live in the Store WAL." }
    ],
    "delete_guarded_invariants": [
      { "name": "no path-only open anywhere in the tree at epic end", "close": "rg 'fn open\\(.*Path' crates/kyzo-core/src/store crates/kyzo-core/src/session → zero public hits; open requires StoreOpen" },
      { "name": "no second commit-door besides the SweepDoor", "close": "rg 'Committed::' crates/kyzo-core/src → construction sites only inside store/sweep.rs" }
    ],
    "not_deletes": [
      { "item": "the current Storage/ReadTx/WriteTx contract (03's relocation)", "why": "The Spec machine composes over it as the ordered-byte substrate; the SweepDoor and WAL wrap the adapter, they do not delete it." },
      { "item": "exact full-scan top-k under cost refuse", "why": "§14: legal, admitted under Engine starts-or-not / Store debt — never Unconstructible." }
    ],
    "meters": [
      "rg -n 'decrypt_export' crates → zero",
      "rg -n 'put_record' crates/kyzo-core/src → zero public app-facing hits",
      "rg -n 'FsyncCapable' crates → zero"
    ]
  },
  "refused": {
    "law": "The Refused claim-tag ledger. Every variant lands in the closed StoreRefuse / EngineRefuse enums (store/failure.rs owns the Store side; session doors own admission variants). Named door + Spec seat for each.",
    "items": [
      { "name": "open without StoreOpen capability", "tag": "Refused", "variant": "MissingStoreOpenCapability", "door": "store/open.rs", "authority": "decisions.md §5", "why": "Path-only open is ambient authority; successful path-only open is Unconstructible, the attempt refuses." },
      { "name": "second writer against a locally fenced address", "tag": "Refused", "variant": "StoreFenced", "door": "store/authority.rs address fence", "authority": "decisions.md §2", "why": "Local mutex among Engines sharing one token — not protection against cp -r." },
      { "name": "seal attempt from a dead incarnation or epoch", "tag": "Refused", "variant": "WriteSessionDead (optional recovery-link payload)", "door": "store/sweep.rs commit-door recheck", "authority": "decisions.md §25/§36", "why": "Resurrected task reaches the door and seals zero bytes — closes the async resurrection window without leases or clocks." },
      { "name": "orphan write after observed RecoveryGrant", "tag": "Refused", "variant": "AuthorityRecovered", "door": "store/sweep.rs + session/admit.rs next admission-visible write boundary", "authority": "decisions.md §2/§36", "why": "The recovery-link-carrying cousin of WriteSessionDead." },
      { "name": "epoch advance while current-epoch Fenced footprints live", "tag": "Refused", "variant": "EpochAdvanceBlocked", "door": "store/epoch.rs advance (IntentClear)", "authority": "decisions.md §36/§72", "why": "Ordinary advance requires IntentClear; RecoveryGrant advance is exempt under epoch-indexed footprint law." },
      { "name": "resolve of a Pending object past its cut", "tag": "Refused", "variant": "Decayed", "door": "store/objects.rs resolve", "authority": "decisions.md §22", "why": "Expiry authority is Store cut comparison only; fabric clocks decide nothing." },
      { "name": "object bytes gone while cut still live", "tag": "Refused", "variant": "ObjectMissing", "door": "store/objects.rs resolve", "authority": "decisions.md §22", "why": "Early fabric delete is a fabric fault, never a silent empty success." },
      { "name": "Durable delete without covering retention certificate", "tag": "Refused", "variant": "ObjectRetainRequired", "door": "store/objects.rs GC", "authority": "decisions.md §23", "why": "Retention certificates gate Durable only; Pending lives under cut law." },